<?xml version="1.0" encoding="UTF-8"?>
<!DOCTYPE Locale SYSTEM 'locale.dtd'>
<Locale versionDTD="2.0" allowUpdateFromCLDR="no" version="1.2">
<LC_INFO>
<Language>
<LangID>fr</LangID>
<DefaultName>French</DefaultName>
</Language>
<Country>
<CountryID>MC</CountryID>
<DefaultName>Monaco</DefaultName>
</Country>
</LC_INFO>
<LC_CTYPE ref="fr_FR"/>
<LC_FORMAT ref="fr_FR" replaceTo="[$F-180C]"/>
<LC_COLLATION ref="fr_FR"/>
<LC_SEARCH ref="en_US"/>
<LC_INDEX ref="fr_FR"/>
<LC_CALENDAR ref="fr_FR"/>
<LC_CURRENCY>
<Currency default="true" usedInCompatibleFormatCodes="true">
<CurrencyID>F</CurrencyID>
<CurrencySymbol>F</CurrencySymbol>
<BankSymbol>FRF</BankSymbol>
<CurrencyName>Franc</CurrencyName>
<DecimalPlaces>2</DecimalPlaces>
</Currency>
</LC_CURRENCY>
<LC_TRANSLITERATION ref="en_US"/>
<LC_MISC ref="fr_FR"/>
<LC_NumberingLevel ref="en_US"/>
<LC_OutLineNumberingLevel ref="en_US"/>
</Locale>
