<?xml version="1.0" encoding="UTF-8"?>
<!DOCTYPE Locale SYSTEM 'locale.dtd'>
<Locale version="1.2">
<LC_INFO>
<Language>
<LangID>fr</LangID>
<DefaultName>French</DefaultName>
</Language>
<Country>
<CountryID>LU</CountryID>
<DefaultName>Luxembourg</DefaultName>
</Country>
</LC_INFO>
<LC_CTYPE ref="fr_FR"/>
<LC_FORMAT ref="fr_FR" replaceTo="[$F-140C]"/>
<LC_COLLATION ref="fr_FR"/>
<LC_SEARCH ref="en_US"/>
<LC_CALENDAR ref="fr_FR"/>
<LC_CURRENCY ref="de_LU"/>
<LC_TRANSLITERATION ref="en_US"/>
<LC_MISC ref="fr_FR"/>
<LC_NumberingLevel ref="en_US"/>
<LC_OutLineNumberingLevel ref="en_US"/>
</Locale>
