<?xml version="1.0" encoding="UTF-8"?>
<!DOCTYPE Locale SYSTEM 'locale.dtd'>
<Locale version="1.2">
<LC_INFO>
<Language>
<LangID>ar</LangID>
<DefaultName>Arabic</DefaultName>
</Language>
<Country>
<CountryID>TN</CountryID>
<DefaultName>Tunisia</DefaultName>
</Country>
</LC_INFO>
<LC_CTYPE ref="ar_EG"/>
<LC_FORMAT ref="ar_EG" replaceTo="[$د.ت.‏-1C01]"/>
<LC_COLLATION ref="en_US"/>
<LC_SEARCH ref="en_US"/>
<LC_CALENDAR>
<Calendar unoid="gregorian" default="true">
<DaysOfWeek ref="ar_SA_gregorian"/>
<MonthsOfYear>
<Month>
<MonthID>jan</MonthID>
<DefaultAbbrvName>ينا</DefaultAbbrvName>
<DefaultFullName>يناير</DefaultFullName>
</Month>
<Month>
<MonthID>feb</MonthID>
<DefaultAbbrvName>فبر</DefaultAbbrvName>
<DefaultFullName>فبراير</DefaultFullName>
</Month>
<Month>
<MonthID>mar</MonthID>
<DefaultAbbrvName>مار</DefaultAbbrvName>
<DefaultFullName>مارس</DefaultFullName>
</Month>
<Month>
<MonthID>apr</MonthID>
<DefaultAbbrvName>أبر</DefaultAbbrvName>
<DefaultFullName>أبريل</DefaultFullName>
</Month>
<Month>
<MonthID>may</MonthID>
<DefaultAbbrvName>ماي</DefaultAbbrvName>
<DefaultFullName>مايو</DefaultFullName>
</Month>
<Month>
<MonthID>jun</MonthID>
<DefaultAbbrvName>يون</DefaultAbbrvName>
<DefaultFullName>يونيو</DefaultFullName>
</Month>
<Month>
<MonthID>jul</MonthID>
<DefaultAbbrvName>يول</DefaultAbbrvName>
<DefaultFullName>يوليو</DefaultFullName>
</Month>
<Month>
<MonthID>aug</MonthID>
<DefaultAbbrvName>أغس</DefaultAbbrvName>
<DefaultFullName>أغسطس</DefaultFullName>
</Month>
<Month>
<MonthID>sep</MonthID>
<DefaultAbbrvName>سبت</DefaultAbbrvName>
<DefaultFullName>سبتمبر</DefaultFullName>
</Month>
<Month>
<MonthID>oct</MonthID>
<DefaultAbbrvName>أكت</DefaultAbbrvName>
<DefaultFullName>أكتوبر</DefaultFullName>
</Month>
<Month>
<MonthID>nov</MonthID>
<DefaultAbbrvName>نوف</DefaultAbbrvName>
<DefaultFullName>نوفمبر</DefaultFullName>
</Month>
<Month>
<MonthID>dec</MonthID>
<DefaultAbbrvName>ديس</DefaultAbbrvName>
<DefaultFullName>ديسمبر</DefaultFullName>
</Month>
</MonthsOfYear>
<Eras ref="ar_LB_gregorian"/>
<StartDayOfWeek>
<DayID>sat</DayID>
</StartDayOfWeek>
<MinimalDaysInFirstWeek>1</MinimalDaysInFirstWeek>
</Calendar>
<Calendar unoid="hijri" default="false">
<DaysOfWeek ref="ar_EG_hijri"/>
<MonthsOfYear>
<Month>
<MonthID>jan</MonthID>
<DefaultAbbrvName>محرم</DefaultAbbrvName>
<DefaultFullName>محرم</DefaultFullName>
</Month>
<Month>
<MonthID>feb</MonthID>
<DefaultAbbrvName>صفر</DefaultAbbrvName>
<DefaultFullName>صفر</DefaultFullName>
</Month>
<Month>
<MonthID>mar</MonthID>
<DefaultAbbrvName>ربيع الأول</DefaultAbbrvName>
<DefaultFullName>ربيع الأول</DefaultFullName>
</Month>
<Month>
<MonthID>apr</MonthID>
<DefaultAbbrvName>ربيع الاخر</DefaultAbbrvName>
<DefaultFullName>ربيع الاخر</DefaultFullName>
</Month>
<Month>
<MonthID>may</MonthID>
<DefaultAbbrvName>جماد الأول</DefaultAbbrvName>
<DefaultFullName>جماد الأول</DefaultFullName>
</Month>
<Month>
<MonthID>jun</MonthID>
<DefaultAbbrvName>جماد الاخر</DefaultAbbrvName>
<DefaultFullName>جماد الاخر</DefaultFullName>
</Month>
<Month>
<MonthID>jul</MonthID>
<DefaultAbbrvName>رجب</DefaultAbbrvName>
<DefaultFullName>رجب</DefaultFullName>
</Month>
<Month>
<MonthID>aug</MonthID>
<DefaultAbbrvName>شعبان</DefaultAbbrvName>
<DefaultFullName>شعبان</DefaultFullName>
</Month>
<Month>
<MonthID>sep</MonthID>
<DefaultAbbrvName>رمضان</DefaultAbbrvName>
<DefaultFullName>رمضان</DefaultFullName>
</Month>
<Month>
<MonthID>oct</MonthID>
<DefaultAbbrvName>شوال</DefaultAbbrvName>
<DefaultFullName>شوال</DefaultFullName>
</Month>
<Month>
<MonthID>nov</MonthID>
<DefaultAbbrvName>ذو القعدة</DefaultAbbrvName>
<DefaultFullName>ذو القعدة</DefaultFullName>
</Month>
<Month>
<MonthID>dec</MonthID>
<DefaultAbbrvName>ذو الحجة</DefaultAbbrvName>
<DefaultFullName>ذو الحجة</DefaultFullName>
</Month>
</MonthsOfYear>
<Eras ref="ar_EG_hijri"/>
<StartDayOfWeek>
<DayID>sat</DayID>
</StartDayOfWeek>
<MinimalDaysInFirstWeek>1</MinimalDaysInFirstWeek>
</Calendar>
</LC_CALENDAR>
<LC_CURRENCY>
<Currency default="true">
<CurrencyID>ر.س.‏</CurrencyID>
<CurrencySymbol>د.ت.‏</CurrencySymbol>
<BankSymbol>TND</BankSymbol>
<CurrencyName>Dinar</CurrencyName>
<DecimalPlaces>2</DecimalPlaces>
</Currency>
</LC_CURRENCY>
<LC_TRANSLITERATION ref="en_US"/>
<LC_MISC ref="ar_EG"/>
<LC_NumberingLevel ref="en_US"/>
<LC_OutLineNumberingLevel ref="en_US"/>
</Locale>
