<?xml version="1.0" encoding="UTF-8"?>
<!DOCTYPE Locale SYSTEM 'locale.dtd'>
<Locale versionDTD="2.0" allowUpdateFromCLDR="no" version="1.2">
<LC_INFO>
<Language>
<LangID>en</LangID>
<DefaultName>English</DefaultName>
</Language>
<Country>
<CountryID>BZ</CountryID>
<DefaultName>Belize</DefaultName>
</Country>
</LC_INFO>
<LC_CTYPE ref="en_AU"/>
<LC_FORMAT ref="en_US" replaceTo="[$BZ$-2809]"/>
<LC_COLLATION ref="en_US"/>
<LC_SEARCH ref="en_US"/>
<LC_INDEX ref="en_US"/>
<LC_CALENDAR ref="en_US"/>
<LC_CURRENCY>
<Currency default="true" usedInCompatibleFormatCodes="true">
<CurrencyID>BZ$</CurrencyID>
<CurrencySymbol>BZ$</CurrencySymbol>
<BankSymbol>BZD</BankSymbol>
<CurrencyName>Belize Dollar</CurrencyName>
<DecimalPlaces>2</DecimalPlaces>
</Currency>
</LC_CURRENCY>
<LC_TRANSLITERATION ref="en_US"/>
<LC_MISC ref="en_US"/>
<LC_NumberingLevel ref="en_US"/>
<LC_OutLineNumberingLevel ref="en_US"/>
</Locale>
