<?xml version="1.0" encoding="UTF-8"?>
<!DOCTYPE Locale SYSTEM 'locale.dtd'>
<Locale version="1.2">
<LC_INFO>
<Language>
<LangID>es</LangID>
<DefaultName>Spanish</DefaultName>
</Language>
<Country>
<CountryID>PY</CountryID>
<DefaultName>Paraguay</DefaultName>
</Country>
<Platform>
<PlatformID>generic</PlatformID>
</Platform>
<Varient></Varient>
</LC_INFO>
<LC_CTYPE ref="es_PE"/>
<LC_FORMAT ref="es_AR" replaceTo="[$G-3C0A]"/>
<LC_COLLATION ref="es_ES"/>
<LC_SEARCH ref="es_ES"/>
<LC_CALENDAR ref="es_AR"/>
<LC_CURRENCY>
<Currency default="true" usedInCompatibleFormatCodes="true">
<CurrencyID>G</CurrencyID>
<CurrencySymbol>G</CurrencySymbol>
<BankSymbol>PYG</BankSymbol>
<CurrencyName>Guarani</CurrencyName>
<DecimalPlaces>2</DecimalPlaces>
</Currency>
</LC_CURRENCY>
<LC_TRANSLITERATION ref="es_ES"/>
<LC_MISC ref="es_ES"/>
<LC_NumberingLevel ref="es_ES"/>
<LC_OutLineNumberingLevel ref="es_ES"/>
</Locale>
