<?xml version="1.0" encoding="UTF-8"?>
<!DOCTYPE Locale SYSTEM 'locale.dtd'>
<Locale versionDTD="2.0" allowUpdateFromCLDR="no" version="1.2">
<LC_INFO>
<Language>
<LangID>ar</LangID>
<DefaultName>Arabic</DefaultName>
</Language>
<Country>
<CountryID>LB</CountryID>
<DefaultName>Lebanon</DefaultName>
</Country>
</LC_INFO>
<LC_CTYPE ref="ar_EG"/>
<LC_FORMAT ref="ar_EG" replaceTo="[$ل.ل.‏-3001]"/>
<LC_COLLATION ref="en_US"/>
<LC_SEARCH ref="en_US"/>
<LC_INDEX ref="ar_EG"/>
<LC_CALENDAR>
<Calendar unoid="gregorian" default="true">
<DaysOfWeek ref="ar_EG_gregorian"/>
<MonthsOfYear>
<Month>
<MonthID>jan</MonthID>
<DefaultAbbrvName>كانون الثاني</DefaultAbbrvName>
<DefaultFullName>كانون الثاني</DefaultFullName>
</Month>
<Month>
<MonthID>feb</MonthID>
<DefaultAbbrvName>شباط</DefaultAbbrvName>
<DefaultFullName>شباط</DefaultFullName>
</Month>
<Month>
<MonthID>mar</MonthID>
<DefaultAbbrvName>آذار</DefaultAbbrvName>
<DefaultFullName>آذار</DefaultFullName>
</Month>
<Month>
<MonthID>apr</MonthID>
<DefaultAbbrvName>نيسان</DefaultAbbrvName>
<DefaultFullName>نيسان</DefaultFullName>
</Month>
<Month>
<MonthID>may</MonthID>
<DefaultAbbrvName>أيار</DefaultAbbrvName>
<DefaultFullName>أيار</DefaultFullName>
</Month>
<Month>
<MonthID>jun</MonthID>
<DefaultAbbrvName>حزيران</DefaultAbbrvName>
<DefaultFullName>حزيران</DefaultFullName>
</Month>
<Month>
<MonthID>jul</MonthID>
<DefaultAbbrvName>تموز</DefaultAbbrvName>
<DefaultFullName>تموز</DefaultFullName>
</Month>
<Month>
<MonthID>aug</MonthID>
<DefaultAbbrvName>آب</DefaultAbbrvName>
<DefaultFullName>آب</DefaultFullName>
</Month>
<Month>
<MonthID>sep</MonthID>
<DefaultAbbrvName>أيلول</DefaultAbbrvName>
<DefaultFullName>أيلول</DefaultFullName>
</Month>
<Month>
<MonthID>oct</MonthID>
<DefaultAbbrvName>تشرين الأول</DefaultAbbrvName>
<DefaultFullName>تشرين الأول</DefaultFullName>
</Month>
<Month>
<MonthID>nov</MonthID>
<DefaultAbbrvName>تشرين الثاني</DefaultAbbrvName>
<DefaultFullName>تشرين الثاني</DefaultFullName>
</Month>
<Month>
<MonthID>dec</MonthID>
<DefaultAbbrvName>كانون الأول</DefaultAbbrvName>
<DefaultFullName>كانون الأول</DefaultFullName>
</Month>
</MonthsOfYear>
<Eras>
<Era>
<EraID>bc</EraID>
<DefaultAbbrvName>ق.م</DefaultAbbrvName>
<DefaultFullName>ق.م</DefaultFullName>
</Era>
<Era>
<EraID>ad</EraID>
<DefaultAbbrvName>م</DefaultAbbrvName>
<DefaultFullName>م</DefaultFullName>
</Era>
</Eras>
<StartDayOfWeek><DayID>sat</DayID></StartDayOfWeek>
<MinimalDaysInFirstWeek>1</MinimalDaysInFirstWeek>
</Calendar>
<Calendar unoid="hijri" default="false">
<DaysOfWeek ref="ar_EG_gregorian"/>
<MonthsOfYear ref="ar_EG_hijri"/>
<Eras ref="ar_EG_hijri"/>
<StartDayOfWeek><DayID>sat</DayID></StartDayOfWeek>
<MinimalDaysInFirstWeek>1</MinimalDaysInFirstWeek>
</Calendar>
</LC_CALENDAR>
<LC_CURRENCY>
<Currency default="true" usedInCompatibleFormatCodes="true">
<CurrencyID>ل.ل.‏</CurrencyID>
<CurrencySymbol>ل.ل.‏</CurrencySymbol>
<BankSymbol>LBP</BankSymbol>
<CurrencyName>Pound</CurrencyName>
<DecimalPlaces>2</DecimalPlaces>
</Currency>
</LC_CURRENCY>
<LC_TRANSLITERATION ref="en_US"/>
<LC_MISC ref="ar_EG"/>
<LC_NumberingLevel ref="ar_EG"/>
<LC_OutLineNumberingLevel ref="ar_EG"/>
</Locale>
