<?xml version="1.0" encoding="UTF-8"?>
<!DOCTYPE Locale SYSTEM 'locale.dtd'>
<Locale version="1.2">
<LC_INFO>
<Language>
<LangID>sv</LangID>
<DefaultName>Swedish</DefaultName>
</Language>
<Country>
<CountryID>FI</CountryID>
<DefaultName>Finland</DefaultName>
</Country>
</LC_INFO>
<LC_CTYPE ref="sv_SE"/>
<LC_FORMAT ref="sv_SE" replaceTo="[$mk-81D]"/>
<LC_COLLATION ref="en_US"/>
<LC_SEARCH ref="en_US"/>
<LC_CALENDAR>
<Calendar unoid="gregorian" default="true">
<DaysOfWeek>
<Day>
<DayID>sun</DayID>
<DefaultAbbrvName>sö</DefaultAbbrvName>
<DefaultFullName>söndag</DefaultFullName>
</Day>
<Day>
<DayID>mon</DayID>
<DefaultAbbrvName>må</DefaultAbbrvName>
<DefaultFullName>måndag</DefaultFullName>
</Day>
<Day>
<DayID>tue</DayID>
<DefaultAbbrvName>ti</DefaultAbbrvName>
<DefaultFullName>tisdag</DefaultFullName>
</Day>
<Day>
<DayID>wed</DayID>
<DefaultAbbrvName>on</DefaultAbbrvName>
<DefaultFullName>onsdag</DefaultFullName>
</Day>
<Day>
<DayID>thu</DayID>
<DefaultAbbrvName>to</DefaultAbbrvName>
<DefaultFullName>torsdag</DefaultFullName>
</Day>
<Day>
<DayID>fri</DayID>
<DefaultAbbrvName>fr</DefaultAbbrvName>
<DefaultFullName>fredag</DefaultFullName>
</Day>
<Day>
<DayID>sat</DayID>
<DefaultAbbrvName>lö</DefaultAbbrvName>
<DefaultFullName>lördag</DefaultFullName>
</Day>
</DaysOfWeek>
<MonthsOfYear>
<Month>
<MonthID>jan</MonthID>
<DefaultAbbrvName>jan</DefaultAbbrvName>
<DefaultFullName>januari</DefaultFullName>
</Month>
<Month>
<MonthID>feb</MonthID>
<DefaultAbbrvName>feb</DefaultAbbrvName>
<DefaultFullName>februari</DefaultFullName>
</Month>
<Month>
<MonthID>mar</MonthID>
<DefaultAbbrvName>mar</DefaultAbbrvName>
<DefaultFullName>mars</DefaultFullName>
</Month>
<Month>
<MonthID>apr</MonthID>
<DefaultAbbrvName>apr</DefaultAbbrvName>
<DefaultFullName>april</DefaultFullName>
</Month>
<Month>
<MonthID>may</MonthID>
<DefaultAbbrvName>maj</DefaultAbbrvName>
<DefaultFullName>maj</DefaultFullName>
</Month>
<Month>
<MonthID>jun</MonthID>
<DefaultAbbrvName>jun</DefaultAbbrvName>
<DefaultFullName>juni</DefaultFullName>
</Month>
<Month>
<MonthID>jul</MonthID>
<DefaultAbbrvName>jul</DefaultAbbrvName>
<DefaultFullName>juli</DefaultFullName>
</Month>
<Month>
<MonthID>aug</MonthID>
<DefaultAbbrvName>aug</DefaultAbbrvName>
<DefaultFullName>augusti</DefaultFullName>
</Month>
<Month>
<MonthID>sep</MonthID>
<DefaultAbbrvName>sep</DefaultAbbrvName>
<DefaultFullName>september</DefaultFullName>
</Month>
<Month>
<MonthID>oct</MonthID>
<DefaultAbbrvName>okt</DefaultAbbrvName>
<DefaultFullName>oktober</DefaultFullName>
</Month>
<Month>
<MonthID>nov</MonthID>
<DefaultAbbrvName>nov</DefaultAbbrvName>
<DefaultFullName>november</DefaultFullName>
</Month>
<Month>
<MonthID>dec</MonthID>
<DefaultAbbrvName>dec</DefaultAbbrvName>
<DefaultFullName>december</DefaultFullName>
</Month>
</MonthsOfYear>
<Eras>
<Era>
<EraID>bc</EraID>
<DefaultAbbrvName>f.Kr.</DefaultAbbrvName>
<DefaultFullName>f.Kr.</DefaultFullName>
</Era>
<Era>
<EraID>ad</EraID>
<DefaultAbbrvName>e.Kr.</DefaultAbbrvName>
<DefaultFullName>e.Kr.</DefaultFullName>
</Era>
</Eras>
<StartDayOfWeek>
<DayID>mon</DayID>
</StartDayOfWeek>
<MinimalDaysInFirstWeek>4</MinimalDaysInFirstWeek>
</Calendar>
</LC_CALENDAR>
<LC_CURRENCY ref="fi_FI"/>
<LC_TRANSLITERATION ref="en_US"/>
<LC_MISC ref="sv_SE"/>
<LC_NumberingLevel ref="en_US"/>
<LC_OutLineNumberingLevel ref="en_US"/>
</Locale>
