<?xml version="1.0" encoding="UTF-8"?>
<!DOCTYPE Locale SYSTEM 'locale.dtd'>
<Locale version="1.2">
<LC_INFO>
<Language>
<LangID>en</LangID>
<DefaultName>English</DefaultName>
</Language>
<Country>
<CountryID>ZA</CountryID>
<DefaultName>South Africa</DefaultName>
</Country>
</LC_INFO>
<LC_CTYPE ref="en_GB"/>
<LC_FORMAT ref="en_US" replaceTo="[$R-1C09]"/>
<LC_COLLATION ref="en_US"/>
<LC_SEARCH ref="en_US"/>
<LC_CALENDAR ref="en_US"/>
<LC_CURRENCY>
<Currency default="true" usedInCompatibleFormatCodes="true">
<CurrencyID>R</CurrencyID>
<CurrencySymbol>R</CurrencySymbol>
<BankSymbol>ZAR</BankSymbol>
<CurrencyName>Rand</CurrencyName>
<DecimalPlaces>2</DecimalPlaces>
</Currency>
</LC_CURRENCY>
<LC_TRANSLITERATION ref="en_US"/>
<LC_MISC ref="en_US"/>
<LC_NumberingLevel ref="en_US"/>
<LC_OutLineNumberingLevel ref="en_US"/>
</Locale>
