<?xml version="1.0" encoding="UTF-8"?>
<!DOCTYPE Locale SYSTEM 'locale.dtd'>
<Locale version="1.2">
<LC_INFO>
<Language>
<LangID>en</LangID>
<DefaultName>English</DefaultName>
</Language>
<Country>
<CountryID>IE</CountryID>
<DefaultName>Ireland</DefaultName>
</Country>
</LC_INFO>
<LC_CTYPE ref="en_GB"/>
<LC_FORMAT ref="en_GB" replaceTo="[$IR£-1809]"/>
<LC_COLLATION ref="en_US"/>
<LC_SEARCH ref="en_US"/>
<LC_INDEX ref="en_US"/>
<LC_CALENDAR>
<Calendar unoid="gregorian" default="true">
<DaysOfWeek ref="en_US_gregorian"/>
<MonthsOfYear ref="en_US_gregorian"/>
<Eras ref="en_US_gregorian"/>
<StartDayOfWeek>
<DayID>mon</DayID>
</StartDayOfWeek>
<MinimalDaysInFirstWeek>1</MinimalDaysInFirstWeek>
</Calendar>
</LC_CALENDAR>
<LC_CURRENCY>
<Currency default="false" usedInCompatibleFormatCodes="true">
<CurrencyID>IR£</CurrencyID>
<CurrencySymbol>IR£</CurrencySymbol>
<BankSymbol>IEP</BankSymbol>
<CurrencyName>Punt</CurrencyName>
<DecimalPlaces>2</DecimalPlaces>
</Currency>
<Currency default="true" usedInCompatibleFormatCodes="false">
<CurrencyID>euro</CurrencyID>
<CurrencySymbol>€</CurrencySymbol>
<BankSymbol>EUR</BankSymbol>
<CurrencyName>Euro</CurrencyName>
<DecimalPlaces>2</DecimalPlaces>
</Currency>
</LC_CURRENCY>
<LC_TRANSLITERATION ref="en_US"/>
<LC_MISC ref="en_US"/>
<LC_NumberingLevel ref="en_US"/>
<LC_OutLineNumberingLevel ref="en_US"/>
</Locale>
