<?xml version="1.0" encoding="UTF-8"?>
<!DOCTYPE Locale SYSTEM 'locale.dtd'>
<Locale version="1.2">
<LC_INFO>
<Language>
<LangID>nb</LangID>
<DefaultName>Norwegian Bokm√•l</DefaultName>
</Language>
<Country>
<CountryID>NO</CountryID>
<DefaultName>Norway</DefaultName>
</Country>
</LC_INFO>
<LC_CTYPE ref="no_NO"/>
<LC_FORMAT ref="no_NO" replaceTo="[$kr-414]"/>
<LC_COLLATION ref="en_US"/>
<LC_SEARCH ref="en_US"/>
<LC_CALENDAR ref="no_NO"/>
<LC_CURRENCY ref="no_NO"/>
<LC_TRANSLITERATION ref="en_US"/>
<LC_MISC ref="no_NO"/>
<LC_NumberingLevel ref="en_US"/>
<LC_OutLineNumberingLevel ref="en_US"/>
</Locale>
