<?xml version="1.0" encoding="UTF-8"?>
<!DOCTYPE Locale SYSTEM 'locale.dtd'>
<Locale version="1.2">
<LC_INFO>
<Language>
<LangID>ar</LangID>
<DefaultName>Arabic</DefaultName>
</Language>
<Country>
<CountryID>SA</CountryID>
<DefaultName>Saudi Arabia</DefaultName>
</Country>
</LC_INFO>
<LC_CTYPE ref="ar_EG"/>
<LC_FORMAT ref="ar_EG" replaceTo="[$ر.س.‏-401]"/>
<LC_COLLATION ref="en_US"/>
<LC_SEARCH ref="en_US"/>
<LC_INDEX ref="ar_EG"/>
<LC_CALENDAR>
<Calendar unoid="gregorian" default="true">
<DaysOfWeek ref="ar_EG_gregorian"/>
<MonthsOfYear ref="ar_EG_gregorian"/>
<Eras ref="ar_EG_gregorian"/>
<StartDayOfWeek><DayID>sat</DayID></StartDayOfWeek>
<MinimalDaysInFirstWeek>7</MinimalDaysInFirstWeek>
</Calendar>
<Calendar unoid="hijri" default="false">
<DaysOfWeek ref="ar_EG_gregorian"/>
<MonthsOfYear ref="ar_EG_hijri"/>
<Eras ref="ar_EG_hijri"/>
<StartDayOfWeek><DayID>sat</DayID></StartDayOfWeek>
<MinimalDaysInFirstWeek>1</MinimalDaysInFirstWeek>
</Calendar>
</LC_CALENDAR>
<LC_CURRENCY>
<Currency default="true" usedInCompatibleFormatCodes="true">
<CurrencyID>ر.س.‏</CurrencyID>
<CurrencySymbol>ر.س.‏</CurrencySymbol>
<BankSymbol>SAR</BankSymbol>
<CurrencyName>Riyal</CurrencyName>
<DecimalPlaces>2</DecimalPlaces>
</Currency>
</LC_CURRENCY>
<LC_TRANSLITERATION ref="en_US"/>
<LC_MISC ref="ar_EG"/>
<LC_NumberingLevel ref="ar_EG"/>
<LC_OutLineNumberingLevel ref="ar_EG"/>
</Locale>

